{
  "schemaVersion": "0.2.0",
  "id": "s5-concurrent-deduplication",
  "summary": "Two caller operations observe one shared in-flight generation and one provider attempt.",
  "mode": "concurrent_deduplication",
  "request": { "requestedModel": "model-a" },
  "observations": [
    {
      "id": "observation-1",
      "role": "request",
      "outcome": "generated_result",
      "startOffsetMs": 0,
      "durationMs": 60
    },
    {
      "id": "observation-2",
      "role": "request",
      "outcome": "generated_result",
      "startOffsetMs": 10,
      "durationMs": 50
    }
  ],
  "generation": {
    "execution": "shared",
    "startOffsetMs": 0,
    "durationMs": 60,
    "provider": "alpha",
    "resolvedModel": "alpha/model-a",
    "usage": { "inputTokens": 10, "outputTokens": 4 }
  },
  "expected": {
    "logicalOperations": 2,
    "generations": 1,
    "providerAttempts": 1,
    "resultObservations": 2,
    "usageOwners": 1,
    "continuity": "trace_links",
    "metricAccountingGuarantee": "not_asserted"
  }
}
