{
  "schemaVersion": "0.2.0",
  "id": "s6-detached-completion",
  "summary": "A scheduled request, detached generation, and later result observation use durable correlation across separate traces.",
  "mode": "detached_execution",
  "request": { "requestedModel": "model-a" },
  "observations": [
    {
      "id": "observation-1",
      "role": "request",
      "outcome": "scheduled",
      "startOffsetMs": 0,
      "durationMs": 5
    },
    {
      "id": "observation-2",
      "role": "result",
      "outcome": "generated_result",
      "startOffsetMs": 75,
      "durationMs": 5
    }
  ],
  "generation": {
    "execution": "detached",
    "startOffsetMs": 10,
    "durationMs": 60,
    "correlationId": "corr-detached-1",
    "provider": "alpha",
    "resolvedModel": "alpha/model-a",
    "usage": { "inputTokens": 10, "outputTokens": 4 }
  },
  "expected": {
    "logicalOperations": 1,
    "generations": 1,
    "providerAttempts": 1,
    "resultObservations": 2,
    "usageOwners": 1,
    "continuity": "durable_correlation",
    "metricAccountingGuarantee": "not_asserted"
  }
}
